{"schema_version":1,"engine_version":"oqs-quant-engine/0.1.0","account_model":"a_share_cash","orders":[{"intent_id":"long-entry","intent_seq":1,"status":"filled","side":"buy","position_effect":"open","order_type":"market","quantity":"100","filled_session_seq":1,"filled_phase":"open"},{"intent_id":"long-exit","intent_seq":2,"status":"filled","side":"sell","position_effect":"close","order_type":"market","quantity":"100","filled_session_seq":2,"filled_phase":"open"},{"intent_id":"research-short-entry","intent_seq":3,"status":"filled","side":"sell","position_effect":"open","order_type":"market","quantity":"100","filled_session_seq":3,"filled_phase":"open"},{"intent_id":"research-short-cover","intent_seq":4,"status":"filled","side":"buy","position_effect":"close","order_type":"market","quantity":"100","filled_session_seq":4,"filled_phase":"open"}],"trades":[{"trade_id":"fill:long-entry","intent_id":"long-entry","session_seq":1,"side":"buy","position_effect":"open","quantity":"100","fill_price_atoms":"1010","notional_atoms":"101000","fee_atoms":"61","stamp_duty_atoms":"0","slippage_atoms":"1000","liquidity":"taker"},{"trade_id":"fill:long-exit","intent_id":"long-exit","session_seq":2,"side":"sell","position_effect":"close","quantity":"100","fill_price_atoms":"1190","notional_atoms":"119000","fee_atoms":"72","stamp_duty_atoms":"119","slippage_atoms":"1000","liquidity":"taker"},{"trade_id":"fill:research-short-entry","intent_id":"research-short-entry","session_seq":3,"side":"sell","position_effect":"open","quantity":"100","fill_price_atoms":"990","notional_atoms":"99000","fee_atoms":"60","stamp_duty_atoms":"99","slippage_atoms":"1000","liquidity":"taker"},{"trade_id":"fill:research-short-cover","intent_id":"research-short-cover","session_seq":4,"side":"buy","position_effect":"close","quantity":"100","fill_price_atoms":"910","notional_atoms":"91000","fee_atoms":"55","stamp_duty_atoms":"0","slippage_atoms":"1000","liquidity":"taker"}],"positions":[{"intent_id":"long-entry","session_seq":1,"signed_quantity":"100","eligible_quantity":"0"},{"intent_id":"long-exit","session_seq":2,"signed_quantity":"0","eligible_quantity":"0"},{"intent_id":"research-short-entry","session_seq":3,"signed_quantity":"-100","eligible_quantity":"0"},{"intent_id":"research-short-cover","session_seq":4,"signed_quantity":"0","eligible_quantity":"0"}],"cash_ledger":[{"intent_id":"long-entry","session_seq":1,"notional_delta_atoms":"-101000","fee_delta_atoms":"-61","stamp_duty_delta_atoms":"0","realized_pnl_delta_atoms":"0","funding_delta_atoms":"0","resulting_cash_atoms":"898939"},{"intent_id":"long-exit","session_seq":2,"notional_delta_atoms":"119000","fee_delta_atoms":"-72","stamp_duty_delta_atoms":"-119","realized_pnl_delta_atoms":"0","funding_delta_atoms":"0","resulting_cash_atoms":"1017748"},{"intent_id":"research-short-entry","session_seq":3,"notional_delta_atoms":"99000","fee_delta_atoms":"-60","stamp_duty_delta_atoms":"-99","realized_pnl_delta_atoms":"0","funding_delta_atoms":"0","resulting_cash_atoms":"1116589"},{"intent_id":"research-short-cover","session_seq":4,"notional_delta_atoms":"-91000","fee_delta_atoms":"-55","stamp_duty_delta_atoms":"0","realized_pnl_delta_atoms":"0","funding_delta_atoms":"0","resulting_cash_atoms":"1025534"}],"funding_ledger":[],"equity_curve":[{"session_seq":1,"timestamp":"2026-01-02T07:00:00Z","mark_price_atoms":"1100","cash_atoms":"898939","signed_quantity":"100","equity_atoms":"1008939"},{"session_seq":2,"timestamp":"2026-01-05T07:00:00Z","mark_price_atoms":"1200","cash_atoms":"1017748","signed_quantity":"0","equity_atoms":"1017748"},{"session_seq":3,"timestamp":"2026-01-06T07:00:00Z","mark_price_atoms":"1000","cash_atoms":"1116589","signed_quantity":"-100","equity_atoms":"1016589"},{"session_seq":4,"timestamp":"2026-01-07T07:00:00Z","mark_price_atoms":"900","cash_atoms":"1025534","signed_quantity":"0","equity_atoms":"1025534"}],"drawdown_curve":[{"session_seq":1,"equity_atoms":"1008939","peak_equity_atoms":"1008939","drawdown_atoms":"0","drawdown_rate_atoms":"0"},{"session_seq":2,"equity_atoms":"1017748","peak_equity_atoms":"1017748","drawdown_atoms":"0","drawdown_rate_atoms":"0"},{"session_seq":3,"equity_atoms":"1016589","peak_equity_atoms":"1017748","drawdown_atoms":"-1159","drawdown_rate_atoms":"-1138"},{"session_seq":4,"equity_atoms":"1025534","peak_equity_atoms":"1025534","drawdown_atoms":"0","drawdown_rate_atoms":"0"}],"metrics":{"starting_equity_atoms":"1000000","ending_equity_atoms":"1025534","net_pnl_atoms":"25534","total_return_rate_atoms":"25534","max_drawdown_atoms":"-1159","max_drawdown_rate_atoms":"-1138","total_fees_atoms":"248","total_stamp_duty_atoms":"218","total_funding_atoms":"0","total_slippage_atoms":"4000","fill_count":4,"closed_trade_count":2,"open_position_count":0},"costs":{"commission_atoms":"248","stamp_duty_atoms":"218","funding_atoms":"0","slippage_atoms":"4000"},"assumptions":{"fill_model":"ohlc_full_fill_v1","partial_fills":false,"liquidate_on_end":false,"research_short":true,"research_short_notice":"hypothetical research model; not ordinary cash-account trading capability","one_x_notional":false}}
